Id,Title,Description,Date,Duration,Type,Session,Track,Presenters,Materials
1273,Directional dark matter search with nuclear emulsion,"Direct dark matter searches are promising techniques to identify the nature of dark matter particles. A variety of experiments have been developed over the past decades, aiming to detect Weakly Interactive Massive Particles (WIMPs) via their scattering in a detector medium. Exploiting directionality would also give a proof of the galactic origin of dark matter making it possible to have a clear and unambiguous signal to background separation. The directional detection of Dark Matter requires very sensitive experiment combined with highly performant technology. The NEWSdm experiment, based on nuclear emulsions, is proposed to measure the direction of WIMP-induced nuclear recoils. We discuss the potentiality, both in terms of exclusion limits and potential discovery, of a directional experiment based on the use of a solid target made by newly developed nuclear emulsions and read-out systems reaching sub-micrometric resolution.",2017-08-21 14:30:00+00:00,30 minutes,Talk,Special Session on Instruments and Methods in HEP,A High Energy Particle Physics:,Murat Ali Guler,
1274,Squeezed light enhanced sensing of a micro-mechanical oscillator,"Ultra-precise measurements of various parameters such as the mass of nano-particles, magnetic fields or gravity can be attained by probing the phononic modes of a micro-mechanical oscillator with light. The sensitivity of such measurements is in part governed by the noise of the phononic mode as well as the noise of the probing light mode, so by decreasing the noise of the probe beam an enhanced sensitivity can be expected. We demonstrate this effect by using squeezed states of light where the quantum uncertainty of the relevant quadrature is reduced below the shot noise level. Using this squeezing-enhanced sensitivity effect, we demonstrate 1) improved feedback cooling of a phononic mode in a microtoroidal cavity and 2) improved sensing of a magnetic field using the coupling to a microtoroidal phononic mode via a magnetorestrictive material. We present our recent experimental results and discuss future directions.",2017-08-21 08:30:00+00:00,30 minutes,Talk,Workshop on continuous variables and quantum information,Workshop on Cont. Variables and Rel. Quantum Information,U L Andersen,
1275,Introduction to noncommutative digital geometry,"Noncommutative geometry, as the generalised notion of geometry, allows us to model the quantum gravity effects in an effective description without full knowledge of quantum gravity itself. On a curved space one must use the methods of Riemannian geometry – but in their quantum version, including quantum differentials, quantum metrics and quantum connections – constituting quantum geometry. The mathematical framework behind it is the noncommutative differential graded algebra. After presenting the motivation and the general framework, I will discuss some recent results on the classification of noncommutative differential geometries, over the finite field F2 (instead that of C), in n = 2,3 and 4 dimensions. The choice of the finite field proposes a new kind of 'discretisation scheme', which we called the 'digital geometry'.",2017-08-24 12:00:00+00:00,40 minutes,Talk,Workshop on NCG,Workshop on Noncommutative Geometry at the Forefront of Physics,Anna Pachol,
1276,Isospin dynamics in nuclear structure,"I will discuss relativistic nuclear field theory (RNFT) as a novel approach to the nuclear many-body problem, which is based on QHD meson-nucleon Lagrangian and relativistic field theory.  RNFT connects consistently the high-energy scale of heavy mesons, the medium-energy range of pion, and the low-energy domain of emergent collective vibrations (phonons) [1]. Mesons and phonons build up the effective interaction in various channels, in particular, the phonon-exchange part takes care of the retardation effects, which are of great importance for the fragmentation of single-particle states, spreading of collective giant resonances and soft modes, quenching and beta-decay rates with significant consequences for astrophysics and theory of weak processes in nuclei.         Over the past decade, RNFT has demonstrated a very good performance in various nuclear structure calculations across the nuclear chart [1,2-4]. Recent progress on the response theory in the proton-neutron channel [5] has allowed a very good description of spin-isospin-flip excitations, which are formed predominantly by pions coupled to proton-neutron configurations in nuclear medium. Such excitations as, for instance, Gamow-Teller and spin-dipole resonances in medium-mass nuclei are of a high astrophysical importance as they are in the direct relation to beta-decay and electron capture rates. More exotic isospin-flip excitations studied lately at NSCL facility have been described very well by RNFT [6]. Presently, excitation modes in the deuteron transfer channel are considered in view of their role in mediating the isoscalar pairing and discussed as constraints for the delta-meson contribution to the nuclear forces [7].    [1] E. Litvinova and P. Ring, Ch. 11 in Relativistic Density Functional for Nuclear Structure, ed. J. Meng (World Scientific, 2016).    [2] E. Litvinova, P. Ring, and V. Tselyaev, Phys. Rev. C 78, 014312 (2008).    [3] J. Endres, E. Litvinova, D. Savran, et al., Phys. Rev. Lett. 105, 212503 (2010).    [4] E. Litvinova, Phys. Rev. C 85, 021303(R) (2012).    [5] E. Litvinova, B.A. Brown, D.-L. Fang, T. Marketin, and R.G.T. Zegers,     Phys. Lett. B  730, 307 (2014). C. Robin and E. Litvinova,  Eur. Phys. J. A 52, 205 (2016).    [6] M. Scott et al., Phys. Rev. Lett. 118, 172501 (2017); K. Miki et al., Phys. Lets. B 769, 339 (2017).    [7] E. Litvinova, C. Robin, and I.A. Egorova, arXiv:1612.09182.",2017-08-21 14:00:00+00:00,30 minutes,Talk,S. Belyaev Memorial Session,Spartak Belyaev Memorial Session,Elena Litvinova,
1277,Anisotropy of dark matter velocity distribution measured with directional detection,"Directional dark matter detection is next-generation experiment of dark matter search. By means of directional information, it can give a constraint on the velocity distribution of dark matter. Especially we investigate the possibility to measure anisotropy of the distribution with gaseous and solid detector in this work.",2017-08-22 09:30:00+00:00,30 minutes,Talk,Special session on Astro-Cosmo-Gravity,Special session on Astro-Cosmo-Gravity,Keiko Nagao,
1278,Worldline colour fields and non-Abelian quantum field theory,"The worldline formalism is a first quantised approach to quantum field theory, inspired by string theory and based upon the evaluation of point particle path integrals as an alternative to traditional field theory techniques. It represents a reorganisation of the physical information of the theory with the advantage of maintaining manifest gauge invariance and simplifying the calculation of scattering amplitudes.     I will describe recent advances in the worldline approach to non-Abelian field theory, explaining how the coupling to the gauge field can be incorporated into the worldline action by introducing auxiliary ""colour"" fields. I will show how these colour fields generate Wilson loop interactions and how a novel Chern-Simons term provides a projection onto an irreducible representation of the gauge group. The calculational efficiency of the worldline formalism is preserved by extending a worldline supersymmetry to the include the colour fields. Finally I will sketch a similar approach to pure Yang-Mills theory and some ongoing work on fields in non-commutative space-time with U(N) symmetry.",2017-08-18 13:30:00+00:00,30 minutes,Talk,Special Session on QCD,Special session on QCD - from vacuum to finite temperatures,James Edwards,
1281,Measurements of the CP violating phase phi_s at LHCb,"The measurement of the mixing-induced CP-violating phase phi_s in the Bs-Bsbar system is one of the key goals of the LHCb experiment. It has been measured at LHCb exploiting the Run I data set and using several decay channels. In particular, the most recent Run I results have been obtained analyzing Bs0->J/psi(->mu+mu-) K+K- candidates in the mass region above the phi(1020) resonance and Bs0 -> Jpsi(->e+e-) phi candidates. However, the precision of phi_s is still limited by the statistics. In this conference, we will present recent results obtained analyzing the Run-II data collected during 2015-2016. Namely, we will present measurements obtained analyzing the golden channel, Bs0->J/psi K+K- in phi(1020) region, and Bs0->J/psi pi+pi-, both with J/psi->mu+mu-.",2017-08-19 14:00:00+00:00,30 minutes,Talk,Parallel session,A High Energy Particle Physics:,Varvara Batozskaya,https://indico.cern.ch/event/559774/contributions/2661202/attachments/1509185/2352772/ICNFP2017_Batozskaya_v2.pdf
1282,Experimental Relativistic Quantum Information with a Geostationary Satellite,"With quantum science in space we reach a regime of physics, where the interplay between general relativity and quantum theory is unclear. A contemporary experimental scenario is satellite-based quantum communication, where an investigation of the impact of gravitational effects is of both, fundamental and technological interest. Specifically, quantum field theory in curved space-time (or relativistic quantum information) is used to describe the aforementioned scenario, while experimental evidence for the predictions are not existing yet [1]. However, the rapid development of quantum technologies in space necessitates a thorough experimental investigation of the relevant physics [2, 3]. Therefore, we investigate potential realization of relativistic quantum information experiments, based on a space-to-ground quantum communication link with a satellite in the geostationary Earth orbit [4]. Thereby, we aim to complement quantum field theory in curved space-time with experimental evidence and to explore possible limitations of satellite-based quantum communication.    [1] R. Howl et al., arXiv:1607.06666 (2016).    [2] D. Rideout et al., Class. Quantum Gravity 29, 224011 (2012).    [3] G. Vallone et al., Phys. Rev. Lett. 116, 253601 (2016).    [4] K. Günthner et al., arXiv:1608.03511 (2016).",2017-08-21 16:30:00+00:00,1 hour,Poster,Poster session,Workshop on Quantum Foundations and Quantum Information,Ömer Bayraktar,
1283,SU(2N_F) symmetry of confinement in QCD and its observation at high T,"We review our previous results on SU(2N_F) symmetry    of hadrons upon artificial subtraction of the near-zero     modes of the Dirac operator, which is a symmetry of confinement    in QCD. We show our recent lattice results on spatial correlators    at high temperature that reveal the same SU(2N_F) symmetry which    has far reaching implications for nature and structure of the    strongly interacting matter at high temperatures.",2017-08-18 14:30:00+00:00,30 minutes,Talk,Special Session on QCD,Special session on QCD - from vacuum to finite temperatures,Leonid Glozman,
1284,Forward Physics at CMS,"In this talk, we will give an overview of the recent forward physics measurements performed with the CMS detector at the LHC.",2017-08-24 13:30:00+00:00,30 minutes,Talk,Parallel session,A High Energy Particle Physics:,Sercan Sen,
1285,Heavy Ion Physics (ATLAS),"The ATLAS experiment at the Large Hadron Collider has undertaken a broad physics program to probe and characterize the hot nuclear matter created in relativistic lead-lead collisions. This talk presents recent results on production of jet, electroweak bosons and quarkonium, electromagnetic processes in ultra-peripheral collisions, and bulk particle collectivity from Pb+Pb and p+Pb collisions.",2017-08-25 11:30:00+00:00,25 minutes,Talk,B Heavy Ion Physics Session,B Heavy Ion Collisions and Critical Phenomena,Mariusz Przybycien,
1286,Counting Unruh particles,We discuss the question of how many Unruh particles can be found in a finite volume.,2017-08-22 13:30:00+00:00,30 minutes,Talk,Workshop on continuous variables and quantum information,Workshop on Cont. Variables and Rel. Quantum Information,Andrzej Dragan,
1287,Search for new physics in HH final state in CMS,Summarise the status of the searches for new physics in HH final state at CMS and projections for CMS,2017-08-19 12:30:00+00:00,30 minutes,Talk,Mini-Workshop on Latest Results and New Physics in the Higgs Sector,Mini-Workshop on Latest Results and New Physics in the Higgs Sector,Konstantin Androsov,
1289,On perturbations in Horndeski theories,TBA,2017-08-21 08:30:00+00:00,30 minutes,Talk,Special session on Astro-Cosmo-Gravity,Special session on Astro-Cosmo-Gravity,Victoria Volkova,
1290,ttH Coupling Measurement with the ATLAS Detector at the LHC,To be included later,2017-08-19 08:30:00+00:00,25 minutes,Talk,Mini-Workshop on Latest Results and New Physics in the Higgs Sector,Mini-Workshop on Latest Results and New Physics in the Higgs Sector,"Asma Hadef, Asma Hadef",
1291,Standard Model Measurements at CMS,"Recent results of Standard Model physics using data recorded by the CMS detector  are presented. This overview includes the latest electroweak and QCD results. In particular precise measurements of the inclusive and differential cross sections for W and Z boson productions, results on V+jets production with light and heavy flavours, multiboson measurements and anomalous couplings searches and also the latest results on jet production and properties. The outlined results are compared to the prediction of the Standard Model.",2017-08-24 14:00:00+00:00,30 minutes,Talk,Parallel session,A High Energy Particle Physics:,Norbert Neumeister,
1292,What is the standard model of particle physics trying to tell us?,"The standard model contains a rather strong hint that -- instead of being simply an ordinary continuous 4D manifold -- spacetime is actually the product of a 4D manifold and a certain discrete/finite space (i.e. there are discrete/finite ""extra dimensions"").  I will introduce this idea and the evidence for it in a simple way.  I will describe recent progress in this direction, as well as some open puzzles and future directions.",2017-08-24 05:30:00+00:00,40 minutes,Talk,Workshop on NCG,Workshop on Noncommutative Geometry at the Forefront of Physics,Latham Boyle,
1293,Hunting for exotic doubly hidden-charm/bottom $QQ\bar Q\bar Q$ tetraquark states,"We develop a moment QCD sum rule method augmented by fundamental inequalities to study the existence of exotic doubly hidden-charm/bottom $QQ\bar Q\bar Q$ tetraquark states made of four heavy quarks. Using the compact diquark-antidiquark configuration, we calculate the mass spectra of these tetraquark states. There are 18 hidden-charm $cc\bar c\bar c$ tetraquark currents with $J^{PC} = 0^{++}$, $0^{-+}$, $0^{--}$, $1^{++}$, $1^{+-}$, $1^{-+}$, $1^{--}$, and $2^{++}$. We use them to perform QCD sum rule analyses, and the obtained masses are all higher than the spontaneous dissociation thresholds of two charmonium mesons, which are thus their dominant decay modes. The masses of the corresponding hidden-bottom $bb\bar b\bar b$ tetraquarks are all below or very close to the thresholds of the $\Upsilon(1S)\Upsilon(1S)$ and $\eta_b(1S)\eta_b(1S)$, except one current of $J^{PC}=0^{++}$. Hence, we suggest to search for the doubly hidden-charm states in the $J/\psi J/\psi$ and $\eta_c(1S)\eta_c(1S)$ channels.",2017-08-23 08:00:00+00:00,30 minutes,Talk,Workshop on Exotic Hadrons,Workshop on Exotic Hadrons,Wei Chen,
1294,LEGEND: new opportunity to discover the neutrinoless double beta decay,No abstract yet,2017-08-29 06:00:00+00:00,30 minutes,Talk,Parallel session,A High Energy Particle Physics:,Konstantin Gusev,
1295,Causal relations in noncommutative spacetime,TBA,2017-08-24 08:40:00+00:00,40 minutes,Talk,Workshop on NCG,Workshop on Noncommutative Geometry at the Forefront of Physics,Tomasz Miller,
1296,Physical models from noncommutative causality,"We introduced few years ago a new notion of causality for noncommutative spacetimes directly related to the Dirac operator and the concept of Lorentzian spectral triple. This notion of causality corresponds to the usual one for commutative spectral triples and could be extended in order to get a full Lorentzian metric. We explored the noncommutative causal structure of several toy models as almost commutative spacetimes and Moyal-Weyl spacetime. From those models, we discovered some unexpected physical interpretations as a geometrical explanation of the ‘Zitterbewegung' trembling motion of a fermion and geometrical constraints on translations and energy jumps of wave packets on Moyal spacetime.",2017-08-24 09:20:00+00:00,40 minutes,Talk,Workshop on NCG,Workshop on Noncommutative Geometry at the Forefront of Physics,Nicolas Franco,
1300,Separate freeze-out of strange particles and the quark-hadron phase transition,"The scenario with the independent chemical freeze-outs of stange and non-strange particles     is presented. Within such a scenario an apparent non-equilibration of strangeness is naturaly     explained by a separation of freeze-outs of stange and non-strange hadrons, which, nevertheless,     are connected by the conservation laws of entropy, baryonic charge and third isospin projection.    An interplay between the separate freeze-out of strangeness and its residual non-equilibration      is studied within an elaborate version of the hadron resonance gas model.     The developed model enables us to perform a high-quality fit of the hadron multiplicity ratios     measured at AGS, SPS and RHIC with an overall fit quality $\chi^2/dof=0.93$. A special attention     is paid to a description of the Strangeness Horn and to the well-known problem of selective suppression of     $\Lambda^-$ and $\Xi$ hyperons. It is remarkable that, for all collision energies, the     strangeness non-equilibrtion factor $\gamma_s$ is about 1 within the error bars. The only     exception is found in the vicinity of the center-of-mass collision energy 7.6 GeV, at which a    20% enhancement of strangeness is observed. Our previus results about the existence of strong jumps of     the chemical freeze-out pressure, temperature and effective number of degrees found at the center-of-mass    collision energy from 4.3 to 4.9 GeV are also confirmed. The arguments in  favor of an exceptional    role of these irregularities as the signals of the quark-gluon-hadron mixed phase formation at this    energies are given.",2017-08-24 08:30:00+00:00,30 minutes,Talk,Workshop on Physics at FAIR-NICA-SPS-BES/RHIC,Workshop on Physics at FAIR-NICA-SPS-BES/RHIC,Oleksii Ivanytskyi,
1301,Probing the tricritical endpoint of QCD phase diagram at NICA-FAIR energies,"In this talk I present several remarkable irregularities at chemical    freeze-out which are found using an advanced version of the hadron    resonance gas model. The most prominent of them are the sharp peaks of the    trace anomaly and baryonic charge density existing at chemical freeze-out    at the center-of-mass energies 4.9 GeV and 9.2 GeV. They are accompanied    by two sets of highly correlated quasi-plateaus in the collision energy    dependence of the entropy per baryon, total pion number per baryon, and    thermal pion number per baryon which are found at the center-of-mass    energies 3.8–4.9 GeV and 7.6–9.2 GeV. The low-energy set of quasi-plateaus    was predicted a long time ago. On the basis of the generalized    shock-adiabat model I show that the low-energy correlated quasi-plateaus    give evidence for the anomalous thermodynamic properties inside the mixed    phase found at the center-of-mass energies 4.3–4.9 GeV. Furthermore, I    would like to discuss the thermostatic properties of the mixed phase and    the ones of an exponential mass spectrum of hadrons and to present the    practical conclusions for the chemical equilibration of strangeness in    heavy ion collisions. Using the similarity of low- and high-energy    irregularities I argue that the high-energy correlated quasi-plateaus may    correspond to a second phase transition.  Its possible origin and a    possible location of the tricritical endpoint of QCD matter phase diagram    are also discussed.",2017-08-24 08:00:00+00:00,30 minutes,Talk,Workshop on Physics at FAIR-NICA-SPS-BES/RHIC,Workshop on Physics at FAIR-NICA-SPS-BES/RHIC,Kyrill Bugaev,
1302,Status and plans of the Compact Linear Collider project,"The Compact Linear Collider (CLIC) project is investigating the possibility to build a multi-TeV linear electron-positron collider for high-energy frontier physics studies. CLIC is based on high-gradient normal-conducting accelerating structures. The high-power RF for the acceleration of the colliding beams is provided by a two-beam acceleration scheme, in which power is extracted from a high current drive beam that runs parallel with the main linac.    CLIC is foreseen to be built and operated in stages, which have been recently redefined taking into account the latest technology developments and the currently-known physics landscape.    The key ongoing studies involve accelerator parameters and cost optimisation, power consumption reduction, component development, and include a number of system performance studies in test facilities around the world.    An overview of the progress and the status of the corresponding studies will be given, as well as an outline of the preparation and work towards developing a CLIC implementation plan by 2019.",2017-08-28 07:40:00+00:00,35 minutes,Talk,Workshop on Future of Fundamental Physics,A High Energy Particle Physics:,Davide Gamba,
1303,Beyond the phenomenology of the BCS model,"The BCS model is revisited and it is shown that the phenomenology predicted by it is much richer than it was thought before. I will show in realistic situations that the phase transition from the superconducting state to the normal (metal) state may be of the first order (the energy gap may have a jump at the phase transition), there may be two solutions for the energy gap equation, etc.    I show both, zero temperature [1] and finite temperature results [2].    [1] D. V. Anghel, arXiv:1609.07931.    [2] D. V. Anghel and G. A. Nemnes, Physica A 464, 74 (2016).",2017-08-23 15:00:00+00:00,30 minutes,Talk,Parallel session,"C Quantum Physics, Quantum Optics and Quantum Information",Dragos-Victor Anghel,
1304,Phenomenological scenarios to fit a possible excess in the di-muon + jets channel,"A reanalysis of LEP data has shown a slight excess in a channel characterised by two muons and bottom quarks. Triggered by this fluctuations, I will discuss phenomenological scenarios of new physics which can generate such signature and discuss their compatibility with data from LHC currently under scrutiny.",2017-08-19 14:00:00+00:00,30 minutes,Talk,Mini-Workshop on Latest Results and New Physics in the Higgs Sector,Mini-Workshop on Latest Results and New Physics in the Higgs Sector,Luca Panizzi,
1305,New Capabilities of Modern Accelerators for Heavy Ion  Nuclear Physics,"Recent developments of heavy ion accelerator facilities based on superconducting linacs and large synchrotron rings offer new capabilities for heavy ion nuclear physics.     Considerations are focused on new largest heavy ion drivers - mega-science projects NICA and FAIR being under construction – Nuclotron-based Ion Collider Facility in Dubna and the Facility for Antiproton and Ion Research in Darmstadt. Both will provide worldwide unique accelerator and experimental facilities allowing for a large variety of unprecedented fore-front research in beam physics, high energy density physics and applied science.    This presentation outlines recent achievements in high power linear accelerator injection chains, rapid cycling superconducting magnets of large synchrotron rings, ultra-high dynamic vacuum technologies, efficient accumulation and cooling of intense heavy ion beams.    Reference: http://nica.jinr.ru/                        www.fair-center.eu",2017-08-22 12:30:00+00:00,30 minutes,Talk,Special Session on Instruments and Methods in HEP,A High Energy Particle Physics:,Boris Sharkov,
1307,Culture event and talk by Katerina Karkala in the Church of OAC,,2017-08-17 16:00:00+00:00,1h 30m,,,,,
1308,Talk history of Crete in the veranda by Emanuela Larentzakis,,2017-08-17 18:00:00+00:00,1 hour,,,,,
1309,Concert of classical music,,2017-08-18 17:00:00+00:00,30 minutes,,,,,
1310,Culture event,Visit to the Monastery and Museum Gonia and talk in the Veranda of the Museum,2017-08-19 16:00:00+00:00,1h 30m,,,,,
1314,Public talk,,,1 hour,,,,,
1315,Opera gala,,2017-08-24 18:30:00+00:00,1 hour,,,,,
1316,Excursion in Chania,,2017-08-25 13:00:00+00:00,4h 30m,,,,,
1317,Cultural event with Classical Music,,2017-08-26 15:00:00+00:00,2h 30m,,,,,
1318,Concert of classical music,,2017-08-26 18:30:00+00:00,1 hour,,,,,
1319,Excursion,,2017-08-27 04:00:00+00:00,7 hours,,,,,
1320,"Round Table on “High Energy Physics after the LHC” (Sergio Bertolucci, University of Bologna and ex-CERN research director, Jie Gao, CEPC institution board vice-chairman and chairman of the Asia Linear Collider Steering Committee, Victor A. Matveev, director of JINR, Russia, Tatsuya Nakada, EPFL Lausanne, CH, chair of the linear collider board (TBC), Albert de Roeck, CERN, leader of the CERN neutrino group, Frank Zimmermann, CERN, deputy leader of FCC, John Womersley, Director General of the European Spallation Source, Moderator: Michael Koratzinos, Univ. of Zurich, CH)",,2017-08-27 16:00:00+00:00,1h 30m,,,,,
1321,Concert,,2017-08-28 18:30:00+00:00,1 hour,,,,,
