Id,Title,Description,Date,Duration,Type,Session,Track,Presenters,Materials
935,The SHiP experiment at CERN,"SHIP is a new general purpose fixed target facility, whose Technical Proposal has been recently reviewed by the CERN SPS Committee and by the CERN Research Board. The two boards recommended that the experiment proceeds further to a Comprehensive Design phase in the context of the new CERN Working group ""Physics Beyond Colliders"", aiming at presenting a CERN strategy for the European Strategy meeting of 2019. In its initial phase, the 400GeV proton beam extracted from the SPS will be dumped on a heavy target with the aim of integrating 2×10^20 pot in 5 years. A dedicated detector, based on a long vacuum tank followed by a spectrometer and particle identification detectors, will allow probing a variety of models with light long-lived exotic particles and masses below O(10) GeV /c2. The main focus will be the physics of the so-called Hidden Portals, i.e. search for Dark Photons, Light scalars and pseudo-scalars, and Heavy Neutrinos. The sensitivity to Heavy Neutrinos will allow for the first time to probe, in the mass range between the kaon and the charm meson mass, a coupling range for which Baryogenesis and active neutrino masses could also be explained. Another dedicated detector will allow the study of neutrino cross-sections and angular distributions. ντ deep inelastic scattering cross sections will be measured with a statistics 1000 times larger than currently available, with the extraction of the F4 and F5 structure functions, never measured so far and allow for new tests of lepton non-universality with sensitivity to BSM physics.",2017-08-23 14:00:00+00:00,30 minutes,Talk,Parallel session,Workshop on Future of Fundamental Physics - Accelerators in HEP and beyond,Walter Marcello Bonivento,
936,On the relationship between electromagnetic curvature and acceleration of charges,"Faraday introduced electric field lines as a powerful tool for understanding the electric force, and field lines are still used today in classrooms and textbooks teaching the basics of electromagnetism within the electrostatic limit. However, despite attempts at generalizing this concept beyond the electrostatic limit, there is currently no field line theory that can be consistent with the complete theory of electromagnetism.    This work will discuss the notion of covariant electromagnetic field lines. We will show that it naturally extends electric field lines to general relativistic systems and derive a closed-form formula for the field lines curvature.    The curvature of electromagnetic field lines completely determines the dynamics of any electric charge and may entail new insights regarding long-standing problems such as radiation-reaction and self-force. In particular, the electromagnetic field lines curvature has the attractive property of being non-singular everywhere, thus eliminates all self-field singularities without using renormalization techniques.    Time permitting, the relationship between field lines curvature to gravity and/or quantum system will be discussed.",2017-08-23 14:30:00+00:00,30 minutes,Talk,Parallel session,"D Cosmology, Astrophysics, Gravity, Mathematical Physics",Yaron Hadad,
939,Indirect dark-matter searches with gamma-rays experiments : status and future plans from 300 KeV to 100 TeV,"Detection of gamma rays and cosmic rays from the annihilation or decay of dark matter particles is a promising method for identifying dark matter, understanding its intrinsic properties, and mapping its distribution in the universe. I will review recent results from the Fermi Gamma-ray Space Telescope and other space-based experiments, and highlight the constraints these currently place on particle dark matter models. I will also discuss the prospects for indirect searches to robustly identify or exclude a dark matter signal using upcoming experiments at energies below Fermi ( ASTROGAM ) and above Fermi:  Magic, H.E.S.S. Veritas, CTA.",2017-08-25 07:00:00+00:00,30 minutes,Talk,"D Astroparticle, Cosmology,d Gravity, Math Phys",Special session on Astro-Cosmo-Gravity,Aldo Morselli,
940,Equation of state of quark gluon plasma using a phenomenological model,"We work on equation of state (EoS) of quark gluon plasma using a simple phenomenological model. In this model, a dynamical quark mass is used as a finite value. The results are significant and agree well with other theoretical results.",2017-08-26 12:00:00+00:00,30 minutes,Talk,Parallel session,B Heavy Ion Collisions and Critical Phenomena,yogesh kumar,
941,Wave function collaspe and gravity,"To make quantum theory consistent, models of spontaneous wave function collapse (collapse models) propose to modify the Schrödinger equation by including nonlinear and stochastic terms, which describe the collapse of the wave function in space. These spontaneous collapses are “rare” for microscopic systems, hence their quantum properties are left almost unaltered. At the same time, since the collapses add coherently in composite systems, macroscopic spatial superpositions of macro-objects are rapidly suppressed. I will review the main features of collapse models. In particular, I will discuss ideas to connect the collapse of the wave function to gravity: The Diosi-Penrose model, Adler’s model and the Schroedinger-Newton equation. Next, I will present an update of the most promising ways of testing them in interferometric and non-interferometric experiments, showing the current lower and upper bounds on their parameters.",2017-08-23 14:00:00+00:00,30 minutes,Talk,Workshop on Quantum Foundations and Quantum Information,Workshop on Quantum Foundations and Quantum Information,Angelo Bassi,
942,Geodesic mapping for non-symmetric gravitation theory (NGT) with torsion,"Connections with (skew-symmetric) torsion on a non-symmetric Riemannian    manifold satisfying the Einstein metricity condition (non-symmetric gravitation    theory (NGT) with torsion) are considered.    In the general case of a geodesic mapping $f$ of two NGT manifolds it is    impossible to obtain a generalization of the Weyl projective    curvature tensor. In the paper we study the case when these manifolds have the same torsion in corresponding points.Such a mapping we name ""equitorsion mapping"".    With respect to  curvature tensors we have    obtained quantities, that are generalizations of the Weyl tensor, i.e. they are invariants based on $f$.  All these    quantities are interesting in constructions of new mathematical and    physical structures.",2017-08-28 12:00:00+00:00,30 minutes,Talk,Special session on Astro-Cosmo-Gravity,Special session on Astro-Cosmo-Gravity,https://me.yahoo.com/a/NjbRTy15qdwcUkUX_tupKsRRNjAALA--#0d66d Zlatanovic,
946,Surrounding matter theory,"In this paper, S.M.T. (Surrounding Matter Theory), an alternative theory to dark matter, is presented. It is based on a modification of Newton’s law. This modification is done by multiplying a Newtonian potential by a given factor, which is varying with local distribution of matter, at the location where the gravitational force is exerted. With this new equation the model emphasizes that a gravitational force is roughly inversely proportional to mass density at the location where this force is applied. After presentation of the model, its dynamic is quickly illustrated by cosmology. Some possible caveats of the model are identified. But the simple mechanism described above suggests the idea of a solution to the following issues: virial theorem mystery, the value of cosmological critical density, the fine tuning issue, and expansion acceleration. A de Sitter Universe is predicted. The predicted time since last scattering is  . This study gives motivation for scientific comparisons with experimental data.",2017-08-21 16:30:00+00:00,1 hour,Poster,Poster session,Special session on Astro-Cosmo-Gravity,Frederic Lassiaille,
947,Search for the violation of Pauli principle at LNGS - first physics result of VIP2 experiment,"We search for x-rays from abnormal atomic orbit electron transitions that may violate the Pauli Exclusion Principle, in the VIP-2 experiment at Gran Sasso national laboratory. The candidate events come from a $2p$ electron transits into a $1s$ orbit which is occupied by two electrons. Such event, if exists, will have detectable energy difference from normal $2p-1s$ atomic transition by few hundreds of electron-volts in case it occurs in a copper atom, and the energy difference is expected to be the result of the electromagnetic shielding effect from the additional electron in the ground state.    The experimental setup with the complete detector system was mounted in the underground laboratory in 2015, and we started the physics run without the final passive lead shielding since October 2016.     From two months of data taking, we confirmed the performance of the apparatus that will fulfill the designed goal of the experiment. Moreover preliminary result from the first period of physics run already improved the upper limit set by the previous VIP experiment.",2017-08-21 16:30:00+00:00,1 hour,Talk,Poster session,"C Quantum Physics, Quantum Optics and Quantum Information",HEXI SHI,
948,PHENIX spin overview,"The spin program at the relativistic heavy ion collider RHIC set out to understand the contribution of gluon and sea quark spins to the total spin of the nucleon. In the PHENIX experiment gluon spins are being accessed via double longitudinal spin asymmetries of neutral final-state pions as well as other final state particles. Using center-of-mass collision energies from 62 to 510 GeV a clear, non-zero gluon polarization at intermediate x could be established. The analysis of final state particles in more forward rapidities also allows to study and constrain the spin contributions to lower x.    In order to access the sea quark spin contribution the production of real W bosons has been studied. The parity violation of the weak interactino allows to select the helicity of the participating quark-antiquark pair and the charge of the produced W boson selects the flavor. Single longitudinal spin asymmetries from leptonic W decays into electrons at central rapidities and muons at forward rapidities have been measured and indicate an asymmetric, polarized light sea.    Furthermore, large transverse single spin asymmetries once thought to be low energy effects persisted to the highest collision energies. They sparked substantial improvements in the understanding of the spin structure of the nucleon and its dynamics while the complete origin of these effects is still not entirely understood. Recent polarized proton-nucleus collisions allowed PHENIX to extend the asymmetry measurements to nucleii and new surprises, especially for forward neutron asymmetries were found.    This presentation will summarize the current status of the PHENIX spin program and a potential future extension.",2017-08-24 06:15:00+00:00,25 minutes,Talk,A Particle Physics,A High Energy Particle Physics:,Ralf Seidl,
950,Models of spontaneous wave function collapse: what they are and how they can be tested,"To make quantum theory consistent, models of spontaneous wave function collapse (collapse models) propose to modify the Schrödinger equation by including nonlinear and stochastic terms, which describe the collapse of the wave function in space. These spontaneous collapses are “rare” for microscopic systems, hence their quantum properties are left almost unaltered. At the same time, since these effects add coherently in composite systems, macroscopic spatial superpositions of macro-objects are rapidly suppressed. I will review the main features of collapse models, in a pedagogical way, by presenting the GRW (Ghirardi-Rimini-Weber) collapse model. Next, I will present an update of the most promising ways of testing them in interferometric and non-interferometric experiments, showing the current lower and upper bounds on their parameters.",2017-08-22 05:30:00+00:00,30 minutes,Talk,C Quantum Optics and Quantum Information,"C Quantum Physics, Quantum Optics and Quantum Information",Angelo Bassi,
951,The physical vacuum in standard theories and in alternative approaches,"We discuss the possible role of the physical vacuum in different approaches to Particle Physics and Cosmology, and suggest new dynamical scenarios involving unconventional vacuum Physics. The internal dynamics of the physical vacuum can be basically independent from that described by standard Quantum Field Theory and with a deeper content. It can play a fundamental role driving the evolution of the Universe and leading the ultimate laws of Particle Physics. Possible preonic structures and pre-Big Bang models are also considered in this respect, as well as a composite structure of standard particle interactions including gravity.     An updated review of these and related problematics is presented, including relevant original patterns. Attention is devoted to the present situation concerning black holes and gravitational waves.",2017-08-29 05:30:00+00:00,30 minutes,Talk,Special session on Astro-Cosmo-Gravity,Mini-Workshop on Latest Results and New Physics in the Higgs Sector,Luis Gonzalez-Mestres,"https://indico.cern.ch/event/559774/contributions/2647709/attachments/1497176/2330102/Cosmological_implications_of_a_preonic_vacuum.pdf, https://indico.cern.ch/event/559774/contributions/2647709/attachments/1497176/2330100/GONZALEZ-MESTRES_Luis_ICNFP2016_lecture.pdf, https://indico.cern.ch/event/559774/contributions/2647709/attachments/1497176/2330103/GONZALEZ-MESTRES_Luis_ICNFP2016_poster2.pdf"
953,"The analogy of equation of rotation in complex plane with the Dirac equation, and its foundation","Quantum mechanics is based or formulated on postulates. The first postulate states that the state of quantum mechanics system is defined by the wave function. The Schrödinger equation has the form of a differential equation describing the evolution process of the function. Dirac equation is derived on the base of that postulate of wave function evolution in addition to Dirac’s proposed linearized Hamiltonian form.     Within the frame of Dirac’s relativistic quantum theory, Hestenes in 1990 refers the complex wave function to a kinematic origin (Zitterbewegung), and Arminjon  argued that Dirac field is a complex vector field.     The present project is not in quantum mechanics. It tries to propose a mathematical model. This model is based on the mathematical foundations of the complex phase factor and the complex vector, those has been proposed by Hestenes and Arminjon. The model is a complex vector in terms of complex phase factor. The project is in two parts. The first tries to find analogy between time differentiation of the complex vector and the position-space Dirac equation . The second tries to find a physical explanation for the complex vector.     In the first part, the equation of time differentiation of the complex vector shows analogy with the Dirac equation form. The two obtained coefficients those corresponding to the Dirac coefficients have similar properties of those of Dirac. These two coefficients are related to the rotation of the point. The second derivative of the complex vector shows analogy with Klein-Gordon equation.     In the second part, the complex vector is considered in trigonometrical form. That led to assume a general real algebraic form for the complex vector, and the complex vector is a special case of the real form. The real trigonometrical form exhibits a real kinematical model. Transformation from real kinematical model to complex form is attributed to partial observation, which is an empirical problem. Sanduk in 2012 proposed the partial observation as an empirical technique for that transformation.",2017-08-25 12:00:00+00:00,30 minutes,Talk,Parallel session,Workshop on Quantum Foundations and Quantum Information,Mohammed Sanduk,
954,The nature and origin of Quantum Mechanics,"An updated discussion is presented of the various approaches to the deep nature and ultimate origin of Quantum Mechanics, with particular emphasis on the possible role of space-time beyond standard relativity and of the physical vacuum beyond standard Quantum Field Theory. Uncertainties on the cosmological history of the generation of Quantum Mechanics are also dealt with. Experimental tests and possible modifications of standard quantum mechanics are equally considered.",2017-08-25 11:30:00+00:00,30 minutes,Talk,Parallel session,Workshop on Quantum Foundations and Quantum Information,Luis Gonzalez-Mestres,"https://indico.cern.ch/event/559774/contributions/2653325/attachments/1497175/2330098/GONZALEZ-MESTRES_Luis_ICNFP2016_lecture.pdf, https://indico.cern.ch/event/559774/contributions/2653325/attachments/1497175/2330099/Quantum_Mechanics_and_the_Spinorial_Space-Time.pdf"
956,PHENIX Measurements of Charm and Bottom Decays,"Heavy flavor quarks are a particularly good tool to probe nuclear collisions at RHIC energies, as they are produced dominantly through the initial parton-parton collision rather than during thermalization. This causes them to experience the full evolution of the collision system. PHENIX has produced several measurements of both bottom and charm quarks through their decays, providing insight to the mass dependent energy loss quarks experience while propagating through the Quark Gluon Plasma (QGP).  This talk will focus on preliminary results of measurements of bottom and charm quarks through their semileptonic decays at $\sqrt{s}=200$ GeV including their nuclear modification factor ($R_{AA}$) and measurements of the nuclear modification of B mesons through the B$\rightarrow$J/ψ decay.",2017-08-25 12:15:00+00:00,20 minutes,Talk,B Heavy Ion Physics Session,B Heavy Ion Collisions and Critical Phenomena,Timothy Rinn,
958,Towards the first measurement of matter-antimatter gravitational interaction,"The AEgIS (Antimatter Experiment: gravity, Interferometry, Spectroscopy) is a CERN based experiment with the central aim to measure directly the gravitational acceleration of antihydrogen. Antihydrogen atoms will be produced via charge exchange reactions which will consist of Rydberg-excited positronium atoms sent to cooled antiprotons within an electromagnetic trap. The resulting Rydberg antihydrogen atoms would then be horizontally accelerated by an electric field gradient (Stark effect), they will then pass through a moiré deflectometer. The vertical deflections caused by the Earth gravitational field will test for the first time the Weak Equivalence principle for antimatter. Detection will be undertaken via a position sensitive detector. Around `10^3` antihydrogen atoms are needed for the gravitational measurement to be undertaken.    The present status, current achievements and results will be presented, with special attention to the strategies to produce positronium atoms in different geometries.",2017-08-26 12:30:00+00:00,30 minutes,Talk,Parallel session,"D Cosmology, Astrophysics, Gravity, Mathematical Physics",Craig William Evans,
959,Recent PHENIX results on high-pT light hadron production,"Production of Quark Gluon Plasma (QGP) has been established in central heavy ion collisions (Au+Au, Cu+Cu) at RHIC energies. Observation of strong suppression of hadron yields at high transverse momentum served as one of the most important evidences in favor of production of a new state of matter in such collisions. Recent RHIC run with asymmetric collision system (Cu+Au) provides the means to systematically study suppression pattern of hadrons in different nuclear overlap geometry needed to improve theoretical description of parton energy loss in QGP.    Non-zero elliptic flow and a hint of suppression of high pT hadrons suggests that mini-QGP can be formed in collisions of light and heavy nuclei characterized by high charged particle multiplicities. To address the question of collective behavior in small systems RHIC provided series of geometry controlled experiments with highly asymmetric systems (p+Al, p+Au, He3+Au).    The recent results from PHENIX experiment at RHIC on charged hadron, pi-zero, eta and phi meson production in asymmetric systems will be presented and discussed.",2017-08-28 12:00:00+00:00,30 minutes,Talk,Parallel session,B Heavy Ion Collisions and Critical Phenomena,Wenqing Fan,
960,Measurements of the Higgs H(125) boson at CMS,"The talk reviews the measurements of the 125 GeV Higgs boson in several final states, performed by the CMS collaboration. The main focus is on results obtained with data from LHC proton-proton collisions at a centre-of-mass energy of 13 TeV.",2017-08-19 08:00:00+00:00,30 minutes,Talk,Mini-Workshop on Latest Results and New Physics in the Higgs Sector,Mini-Workshop on Latest Results and New Physics in the Higgs Sector,Valeria Botta,
961,Low-energy K$^-$ interaction with light nuclei by the AMADEUS collaboration,"The AMADEUS collaboration is aiming to study the K$^-$ hadronic interaction with light nuclei in the low-energy regime with high precision. The main goal is to provide information on the $\bar{\mathrm{K}}$N interaction in nuclear medium, fundamental for the understanding of the non-perturbative QCD in the strangeness sector, with implications going from nuclear physics to astrophysics. Hyperon-nucleon/nuclei (YN) and hyperon-pion (Y$\pi$) correlation studies are performed with the aim to explore the possible existence of deeply bound kaonic states in nuclei and the properties of hyperon resonances in nuclear environment. AMADEUS takes advantage of the DA$\Phi$NE collider, which provides a unique source of monochromatic low-momentum kaons ($p_\mathrm{K}$ ~ 127 MeV/c). As a first step, we explore the hadronic interaction of the negative kaons in the materials of the KLOE detector, which is used as large acceptance and resolution active target, providing a high statistic sample of K$^-$ nuclear absorption on H, $^4$He, $^9$Be and $^{12}$C nuclei. Future plans will be also discussed.",2017-08-29 05:30:00+00:00,30 minutes,Talk,Parallel session,A High Energy Particle Physics:,Raffaele Del Grande,
962,Cosmological bounce and Genesis beyond Horndeski,"We study a ""classical"" bouncing scenario in beyond Horndeski theory. We give an example of spatially flat bouncing solution that is non-singular and stable throughout the whole evolution. The model is arranged in such a way that the scalar field driving the cosmological evolution initially behaves like full-fledged beyond Horndeski, whereas at late times it becomes a massless scalar field minimally coupled to gravity.    Based on arXiv:1705.06626 [hep-th]",2017-08-21 08:00:00+00:00,30 minutes,Talk,Special session on Astro-Cosmo-Gravity,Special session on Astro-Cosmo-Gravity,Roman Kolevatov,
963,Using the Tsallis distribution for hadron spectra in pp collisions,"A thermal model, based on the Tsallis distribution and blast-wave model, is proposed to compute hadron double-differential     spectra $d^{2}N/dp_{\rm T}dy$ in $pp$ (also high-energy $p\overline{p}$) collisions. It successfully describes the    available experimental data on pion and quarkonia ($\phi$, ${\rm J}/\psi$, $\psi({\rm 2S})$, ${\rm\Upsilon}$ family) production at energies from     $\sqrt{s}=$ 5 GeV to the LHC ones. Simple parametrizations for the $\sqrt{s}$ dependence of the model parameters are provided    allowing predictions for the yields of these particles at new collision energies.",2017-08-26 12:30:00+00:00,30 minutes,Talk,Parallel session,A High Energy Particle Physics:,Smbat Grigoryan,
966,The Pierre Auger Observatory: latest results and future perspectives,"The Pierre Auger Observatory  is the largest ultrahigh-energy cosmic ray observatory in the world.    The huge amount of high quality data collected since 2004 up to now, with a total exposure approaching to  60.000 km^2 sr yr, led to great improvements in our knowledge of the ultra-energetic cosmic rays.     The suppression of the cosmic-ray flux at highest energies was clearly established. For the first time the proton-proton cross sections was measured at the energy 57 TeV in the center of mass system. On the other hand, measurements of the depth of shower maximum indicate a puzzling trend  in the mass composition of cosmic rays at energy around the ankle up to the highest energy.     The just started upgrade of the Observatory, dubbed AugerPrime, will improve the identification of the mass  of primaries and then will allow to disentangle among models of origin and propagation of cosmic rays.",2017-08-24 10:00:00+00:00,30 minutes,Talk,"D Astroparticle, Cosmology,d Gravity, Math Phys",Special session on Astro-Cosmo-Gravity,Mario Buscemi,
