Id,Title,Description,Date,Duration,Type,Session,Track,Presenters,Materials
1048,Top-quark results at CMS,"Experimental results on top-quark physics obtained at the CMS experiment are reported based on the data recorded at centre-of-mass energy up to 13 TeV. Inclusive and differential cross sections for both top-quark pair and single top-quark production are presented, as well as measurements of top-quark properties in production and decay, and searches for anomalous couplings. The presented measurements test theoretical predictions, including recent perturbative QCD calculations, provide constraints of fundamental standard model parameters, and set limits on physics beyond the standard model.",2017-08-22 12:20:00+00:00,20 minutes,Talk,Parallel session,A High Energy Particle Physics:,Luca Lista,"https://indico.cern.ch/event/559774/contributions/2661221/attachments/1508391/2351266/Kolymbari.pdf, https://indico.cern.ch/event/559774/contributions/2661221/attachments/1508391/2351264/Kolymbari.pptx"
1049,muon performance,"Muons are of key importance to study some of the most interesting physics topics at the LHC.     We show the status of the performance of the muon reconstruction in the analysis of proton-proton     collisions at the LHC, recorded by the ATLAS detector in 2016 and 2017. Reconstruction efficiency     and momentum resolution have been measured using J/Psi and Z decays for different classes of     reconstructed muons.",2017-08-21 16:30:00+00:00,1 hour,Poster,Poster session,,"Luigi Marchese, Luigi Marchese",
1050,Heavy sterile neutrino with large mixing angle does not contradict cosmology,"We study a model of keV-scale sterile neutrino with      relatively large mixing with the Standard Model sector.  Usual      considerations predict active generation of such particles in the      Early Universe, which leads to constraints from the total Dark      Matter density and absence of X-ray signal from sterile neutrino      decay.  These bounds together may deem any attempt of creation of      the keV scale sterile neutrino in the laboratory unfeasible.  We      argue that for models with a hidden sector coupled to the sterile      neutrino these bounds can be evaded, opening new perspectives for      the experimental studies at neutrino facilities such as Troitsk $\nu$-mass and KATRINE. We estimate the generation of sterile neutrinos in      scenarios with the hidden sector dynamics keeping the sterile      neutrinos either massless or superheavy in the early Universe; in      both cases the generation by oscillations from active neutrinos in      plasma is suppressed.",2017-08-22 10:00:00+00:00,30 minutes,Talk,Special session on Astro-Cosmo-Gravity,Special session on Astro-Cosmo-Gravity,Anton Chudaykin,
1052,Gluon correlators and gluon effective mass in lattice QCD,"We plan to discuss appearance of effective gluon masses in lattice experiments in the Landau gauge gluodynamics framework. We consider both gluon propagator in momentum space and zero-momentum correlator in coordinate space (the latter under various boundary conditions) and observe characteristic ""massive"" behaviour of correlators considered.",2017-08-19 08:25:00+00:00,25 minutes,Talk,Special Session on QCD,Special session on QCD - from vacuum to finite temperatures,Igor Bogolubsky,
1053,GERDA: first background free search for neutrinoless double beta decay,GERDA (GERmanium Detector Array) experiment is designed to search for neutrinoless double beta decay with semiconductor detectors made from germanium enriched in $^{76}$Ge. In GERDA for the first time ever detectors are directly immersed in liquid argon which works as a cooling medium and at the same time as an additional shield against external radioactivity. There are two phases of the GERDA experiment.    Phase I has employed coaxial detectors made from $^{76}$Ge (total mass ~ 18 kg) adopted for liquid argon operations and has successfully finished in May 2013 after reaching the exposure of 20 kg yr. The background index in the region of interest was 0.01 counts/(keV kg yr). The half-life limit for $0\nu\beta\beta$  decay > 2.1 × 10$^{25}$ years has been set (90% C.L.).    In the ongoing GERDA Phase II (started in December 2015) we have the possibility to detect scintillation light in liquid argon surrounding the detectors. Thus argon acts as active veto. In Phase II together with coaxial diodes about 20 kg of novel detectors (so-called BEGe) with enhanced pulse shape discrimination capability are being used to double the target mass. All this has helped to reach the unprecedented background index of 0.001 counts / (keV kg yr). No background event should be left in the energy region where the $0\nu\beta\beta$ signal is expected until the end of data taking in 2019. Thereby GERDA is the first “background-free” experiment in the field. After the first five months of data taking (about 10 kg yr) no $0\nu\beta\beta$ decays have been observed and a half-life limit has been improved to ${T^{0\nu}_{1/2}}$ > 5.3 × 10$^{25}$ yr (90% C.L.). At the time of the Conference a total Phase II exposure of about 40 kg yr is planned to be available.    This talk is dedicated to provide an overview of the GERDA experiment and the physics results achieved in Phase II.,2017-08-24 08:30:00+00:00,30 minutes,Talk,A Particle Physics,A High Energy Particle Physics:,Konstantin Gusev,
1054,Search for Anomalous Quartic Photon Coupling at the LHC,"A search for anomalous quartic photon coupling with forward proton tagging is presented. The motivation for this coupling stems from theories of new phenomena (Composite Higgs, Kaluza-Klein, Warped Extra Dimensions). Forward proton tagging in CMS-TOTEM and Atlas Forward Physics spectrometers allows us to search for anomalous couplings with an unprecedented sensitivity. By imposing conservation of four-momenta on the system, we are able to probe a background free selection in a model independent way. This independence allows us to consider applications such as generic contributions from charged and neutral particles as well as dark matter searches.",2017-08-19 15:00:00+00:00,30 minutes,Talk,Mini-Workshop on Latest Results and New Physics in the Higgs Sector,Mini-Workshop on Latest Results and New Physics in the Higgs Sector,Justin Andrew Williams,
1055,Correlations of anisotropic flow in relativistic heavy-ion collisions at the LHC,"Anisotropic flow is one of the key observables used to probe the properties and evolution of the hot and dense matter produced in heavy-ion collisions. It was recently realized that event-by-event initial geometry fluctuations in heavy-ion collisions lead to a new type of correlation between different order anisotropic flow, which has unique sensitivity to initial conditions and shear viscosity over entropy density ratio $\eta/s$. In this talk, I discuss the correlation strength between various anisotropic flow harmonics, named (normalized-)symmetric cumulants, in both transport and hydrodynamic model calculations. In addition, the correlations between different order flow symmetry plane will be presented. The results can be naturally understood with recent development of non-linear hydrodynamic response of the created hot and dense matter to initial anisotropy coefficients. A detailed comparison of model calculations and recent experimental measurement, is also presented. Last but not least, I will show how to improve the current development of global Bayesian analysis on constraining the initial conditions and the extraction of the properties of the created QGP in relativistic heavy-ion collisions.",2017-08-25 08:00:00+00:00,30 minutes,Talk,Joined Session of Workshop on Physics at FAIR-NICA-SPS-BES/RHIC and Mini-workshop:Correlations and Fluctuations in Relativistic Heavy Ion Collisions,,You Zhou,
1056,The Short Baseline Neutrino Detector at Fermilab,"SBND (Short-Baseline Near Detector) is a 112 ton liquid argon TPC neutrino detector under construction on the Fermilab Booster Neutrino Beam. Together with MicroBooNE and ICARUS-T600, SBND will search for short-baseline neutrino oscillations in the 1 eV^2 mass range. SBND will also perform detailed studies of the physics of neutrino-argon interactions, thanks to a data sample of millions of electron and muon neutrino interactions. Finally SBND plays an important role in the on-going R&D effort to develop the LArTPC technology, testing several technologies that can be used in a future kiloton-scale neutrino detectors for a long-baseline experiment. I will discuss the detector design, its current status, and present the physics program.",2017-08-21 13:30:00+00:00,30 minutes,Talk,Special Session on Instruments and Methods in HEP,,Thomas Josua Mettler,
1057,KamLAND-Zen 800 status and future prospects,"KamLAND-Zen is the neutrinoless double beta decay experiment using 136Xe in the 1,000ton ultra pure liquid scintillator KamLAND. The observation of the neutrinoless double beta decay would help our understanding of neutrino mass and hierarchy by demonstrating the Majorana particle. KamLAND-Zen 400 was ended successfully in 2015. We measured the 136Xe double beta decay life time precisely, and got the limit of neutrinoless double beta decay life time. KamLAND-Zen 800 is a improved experiment using 800kg of 136Xe. This experiment have a potential to survey in inverted hierarchy region of the neutrino mass. I will report KamLAND-Zen 800 status and future prospect.",2017-08-22 14:30:00+00:00,30 minutes,Talk,Parallel session,Workshop on Future of Fundamental Physics - Accelerators in HEP and beyond,Masayuki Koga,
1058,Ubiquitous non-local entanglement with Majorana bound states,"Entanglement in quantum mechanics contradicts local realism, and is a manifestation of quantum non-locality. Its presence can be detected through the violation of Bell, or CHSH inequalities.Paradigmatic quantum systems provide examples of both, non-entangled and entangled states.     Here we consider entanglement of non-local degrees of freedom emerging from topological properties of many-body systems. Specifically, we consider a minimal complexity setup consisting of 6 Majorana bound states. We find that any allowed state in the degenerate Majorana space is non-locally entangled. We show how to measure (with available techniques) the CHSH-violating correlations, using either intermediate strength or weak measurement protocols.",2017-08-23 12:00:00+00:00,30 minutes,Talk,Workshop on Quantum Foundations and Quantum Information,Workshop on Quantum Foundations and Quantum Information,Alessandro Romito,
1059,Thermodynamics along individual trajectories of a quantum bit,"The laws of thermodynamics are fundamental laws of nature that classify energy changes for macroscopic systems as work performed by external driving and heat exchanged with the environment.The extension of thermodynamics to include quantum fluctuations faces unique challenges, such as the proper identification of heat and work, and the clarfication of the role of quantum coherence. We use a near-quantum-limited detector to experimentally track individual quantum trajectories of a driven qubit formed by the hybridization of a waveguide cavity and a transmon circuit. For each measured quantum coherent trajectory, we separately identify energy changes of the qubit as heat and work, and verify the first law of thermodynamics for an open quantum system. We further employ a novel quantum feedback loop to compensate for the exchanged heat and effectively isolate the qubit. By verifying the Jarzynski equality for the distribution of applied work, we demonstrate the validity of the second law of thermodynamics. Our results establish thermodynamics along individual quantum trajectories.",2017-08-21 16:30:00+00:00,1 hour,Poster,Poster session,"C Quantum Physics, Quantum Optics and Quantum Information",Alessandro Romito,
1060,"Quark, gluon and meson correlators of unquenched QCD","We present first-principle results for the 1PI correlation functions of two-flavour Landau-gauge QCD in the vacuum. These correlation functions carry the full information about the theory. They are obtained by solving their Functional Renormalisation Group equations in a systematic vertex expansion, aiming at apparent convergence. This work represents an indispensable and pivotal prerequisite for quantitative first-principle studies of the QCD phase diagram and the hadron spectrum within this framework.    In particular, we have computed the gluon, ghost, quark and scalar-pseudoscalar meson propagators, as well as gluon, ghost-gluon, quark-gluon, quark, quark-meson, and meson interactions. Our results stress the crucial importance of the correct semi-perturbative running of the different vertices in order to quantitatively describe the phenomena and scales of confinement and spontaneous chiral symmetry breaking without further phenomenological input. Furthermore, preliminary results for the correlation functions of pure Yang-Mills at finite temperature are presented.",2017-08-18 08:30:00+00:00,30 minutes,Talk,Special Session on QCD,Special session on QCD - from vacuum to finite temperatures,Mario Mitter,
1061,Dynamics of quantum correlations in two-mode Gaussian open quantum systems,"In the framework of the theory of open systems based on completely positive quantum dynamical semigroups, we make a comparison of the behaviour of continuous variable quantum correlations (quantum entanglement, entropic quantum discord, geometric quantum discord, quantum steering) for a system consisting of: 1) two non-coupled; 2) two coupled bosonic modes embedded in a common environment of the form of a thermal bath or of a squeezed thermal bath. We solve the Markovian master equation for the time evolution of the considered system and describe the quantum correlations in terms of the covariance matrix for Gaussian input states. Depending on the values of the parameters characterizing the initial state of the system (squeezing parameter, average photon numbers), the coefficients describing the interaction of the system with the reservoir (temperature, dissipation constant), and the intensity of the interaction between the two modes, one may notice phenomena like generation of quantum correlations, their suppression (sudden death), periodic revivals and suppressions, or an asymptotic decay in time of quantum correlations.",2017-08-21 12:00:00+00:00,20 minutes,Talk,Workshop on continuous variables and quantum information,Workshop on Cont. Variables and Rel. Quantum Information,Aurelian Isar,
1062,Threshold effects in hadron spectrum: a new spectroscopy?,"Between November $1974$, when the $J/\psi$ particle was discovered, and $2003$,     when the $X(3872)$ resonance was hunted by the Belle Collaboration, the     charmonium spectrum was fairly explained by naive quark models. However, the     exploration of the spectrum for energies above the $D\bar{D}$ threshold has led     to the appearance of unexpected states, difficult to accommodate in the naive     quark model picture.    The mentioned $X(3872)$ has properties that cannot be explained assuming a     simple quark-antiquark structure; for example, its decay into $\pi\pi J/\psi$     through a $\rho$ meson is an isospin violating decay. However, this property can     be nicely explained in a picture in which the $X(3872)$ is understood as a     $D\bar D^{\ast}$ bound state, due to the isospin violation in the $D$ and     $D^{\ast}$ masses and the close position of the state to the $D^0\bar D^{*\,0}$     threshold. In addition to the $X(3872)$, there are other states such as the     $D_{s0}(2317)^\ast$ and $D_{s1}(2460)$ which can be described as a $DK$ and     $D^\ast K$ molecules, respectively; or the $P^\ast_c(4380)$ and     $P^\ast_c(4450)$ which are two exotic structures discovered in $2015$ by the     LHCb Collaboration in the $J/\psi p$ channel, lie near the $\bar     D\Sigma^{(\ast)}_c$ thresholds and are compatible with pentaquark     interpretations.    The common feature among all these exotic states is the presence of nearby     two-particle thresholds. This reinforces the intuition that the residual     interaction between the two particles can form a new molecular state or     renormalize the mass of the original naive $q\bar q$ state. Some times the     interaction is not enough to bind a molecule and a threshold cusp may be formed.     Then, one can expect that near each meson-meson or baryon-meson thresholds some     new structures might appear. The description of this type of structures is very     tricky from a theoretical point of view because the strength of the residual     interaction is usually model dependent and one can generate spurious states if     this interaction is not under control.    In this talk, we review the status of a threshold effects calculation in the     meson an baryon spectrum using a constituent quark model~[1], that has been     applied to a wide range of hadronic observables and thus all model parameters     are completely constrained. In the meson sector, the model has been able, for     instance, to reproduce the properties of the $X(3872)$ as a mixture of $c\bar c$     and $D\bar D^\ast$ channels~[2]; and to describe well the spectrum of the     $P$-wave charm strange mesons when $DK$ and $DK^\ast$ structures are taken into     account~[3]. In the baryon sector, the model has described the     $\Lambda_c(2940)^+$~[4, 5] as a $D^\ast N$ molecule, the $X_c(3250)$~[6] as     a $D^\ast\Delta$ one, and the $P^\ast_c(4380)$ and $P^\ast_c(4450)$ states as     $\bar D \Sigma^\ast_c$ and $\bar D\Sigma_c$ candidates~[7]. Some new states     which cannot be accommodated as molecular states will be also discussed.    \vspace{1cm}    [1] J. Vijande, F. Fern\'andez, A. Valcarce J. Phys. G31, 481 (2005); \\    \hspace*{1.00cm} J. Segovia, A.M. Yasser, D.R. Entem, and F. Fern\'andez, Phys.     Rev. D78, 114033 (2008).            [2] P.G. Ortega, D.R. Entem and F. Fern\'andez, J. Phys. G40, 065107 (2013).    [3] P.G. Ortega, J. Segovia, D.R. Entem and F. Fern\'andez,  Phys. Rev. D94,     074037 (2016).    [4] P.G. Ortega, D.R. Entem, F. Fern\'andez, Phys. Rev. D90, 114013 (2014).    [5] P.G. Ortega, D.R. Entem, F. Fern\'andez, Phys. Lett. B718, 1381-1384 (2013).    [6] P.G. Ortega, D.R. Entem, F. Fern\'andez, Phys. Lett. B729, 24-26 (2014).    [7] P.G. Ortega, D.R. Entem and F. Fern\'andez, Phys. Lett. B764, 207 (2017).",2017-08-23 12:00:00+00:00,30 minutes,Talk,Workshop on Exotic Hadrons,Workshop on Exotic Hadrons,Pablo G. Ortega,
1063,New Mathematical Formulation of the Correspondence Principle,"The problem about the classical limit of Quantum Mechanis is a thorny and intriguing issue at the core of modern physics. There remain many doubts about this fundamental question of the foundations of Quantum Mechanics. In the literature,  there are many procedures to aboard this matter, the best known and used are the Planck´s limit ( ) and the Bohr´s Correspondence Principle (n>>1). Nathan Rosen and Richard Libboff have affirmed that this limits are not equivalent and that none of them has a universal charcater.     In this work we propose a new mathematical formulation of the Correspondence Principle. This new approach consists of obtaining the asymptotic limit of quantum probability density. As a result of this procedure, Classical Physics emerges as an asymptotic case of Quantum Mechanics. We show as examples of this procedure the cases of the quantum harmonic oscillator, the Kepler problem, the particle en the square infinity well and the quantum free falling.    With this approach one can understand the difference between the Planck´s limit and the Bohr´s Correspondence Principle. It also allows to clarify some of the differences that exist between Quantum Mechanics al Classical Physics.",2017-08-21 16:30:00+00:00,1 hour,Poster,Poster session,Workshop on Quantum Foundations and Quantum Information,Jorge Bernal Arroyo,
1065,Cylindrical symmetry: II. The Green’s function in 3 + 1 dimensional curved space,"An exact solution to the heat equation in curved space is a much sought after; this report presents a derivation wherein the cylindrical symmetry of the metric in 3 + 1 dimensional curved space has a pivotal role. To elaborate, the spherically symmetric Schwarzschild solution is a staple of textbooks on general relativity; not so perhaps, the static but cylindrically symmetric ones, though they were obtained almost contemporaneously by H.Weyl,Ann.Phys.Lpz.54,117(1917)     and T. Levi-Civita, Atti Acc. Lincei Rend. 28,101(1919). A renewed interest in this subject recently in C.S. Trendafilova and S.A. Fulling ,Eur.J.Phys. 32,1663(2011) – to which the reader is referred to for more references –    motivates this work, the first part of which (cf.Kamath, PoS (ICHEP2016)791) reworked the Antonsen-Bormann idea – arXiv:hep-th/9608141v1 – that was originally intended to compute the heat kernel in curved space to determine – following D.McKeon and T.Sherry,Phys.Rev.D35,3584(1987) – the zeta-function associated with the Lagrangian density for a massive real scalar field theory in 3 + 1 dimensional stationary curved space to one-loop order, the metric for which is cylindrically symmetric. Using the same Lagrangian density the    second part reported here essentially revisits the second paper by Bormann and Antonsen – arXiv:hep 9608142v1 but relies on the formulation by the author in S.G.Kamath, AIP Conf.Proc.1246,174 (2010) to obtain the Green’s function directly by solving a sequence of first order partial differential equations that is preceded by a second order partial differential equation.",2017-08-21 16:30:00+00:00,1 hour,Poster,Poster session,Special session on Astro-Cosmo-Gravity,Gopinath Kamath,
1067,Pontryagin trace anomaly,"It is known that quantum field theories defined on curved spacetimes develop quantum anomalies of a trace of the energy-momentum tensor, called trace anomalies. These anomalies can be classified by using cohomology analysis, which in 4D establishes three possible types of trace anomalies: Euler (or Gauss-Bonnet), Weyl and Pontryagin. While the appearance of Euler and Weyl trace anomalies is a generic property confirmed by explicit calculations, e.g., in the simple theory of free massless Dirac or Weyl spin 1/2 field, the status of Pontryagin anomaly is still not resolved. Moreover, several arguments were stated in the literature which apparently forbid appearance of Pontryagin anomaly for free spin 1/2 fields.    In this talk results that counter this standard story will be presented, showing that free Weyl spin 1/2 fermion on curved four-dimensional spacetime has Pontryagin anomaly, with the imaginary coefficient in front of the Pontryagin density. We have obtained this surprising result by explicit one-loop calculations using dimensional regularisation, by two different methods: (1) direct calculation using the Weyl fermion, (2) by exploiting the coupling to “axial gravity”, which allowed us to work with the Dirac instead of the Weyl field. The Pontryagin anomaly of the Dirac and the Majorana spin 1/2 field is vanishing.    This result has some important consequences, some of which will be discussed. One is that the supposed equivalence between quantum free Majorana and Weyl fields in purely gravitational background cannot be correct. There is also a question of the imaginary value of the anomaly, which may possibly signal the problems with chiral theories in which Weyl fermions are not appearing in pairs with both chiralities, or may have some importance in cosmology due to its unusual gravitational parity-odd nature.",2017-08-28 12:30:00+00:00,30 minutes,Talk,Special session on Astro-Cosmo-Gravity,Special session on Astro-Cosmo-Gravity,Predrag Dominis Prester,
1068,Quantum advantage and fault tolerant universal quantum computing in continuous variables,"Continuous Variables are a promising platform for demonstrating large scale quantum information effects thanks to the experimental advantages they provide. In this framework, we define a general quantum computational model based on a continuous variables hardware. It consists in vacuum input states, a finite set of gates — including non-Gaussian elements — and homodyne detection. We show that this model enables the encoding of fault tolerant universal quantum computing. Furthermore, when restricted to only commuting gates it turns into a sampling problem that can’t be simulated efficiently with a classical computer — unless the polynomial hierarchy collapses. Thus we provide a simple paradigm for short-term experiments relying on Gaussian states, homodyne detection and some form of non-Gaussian evolution.",2017-08-21 14:50:00+00:00,20 minutes,Talk,Workshop on continuous variables and quantum information,Workshop on Cont. Variables and Rel. Quantum Information,Tom Douce,
