Id,Title,Description,Date,Duration,Type,Session,Track,Presenters,Materials
1159,Mixing of positive and negative frequency waves at the optical horizon,"There exist various conditions under which waves of positive and negative Klein-Gordon norm can be made to convert into each other.    For example, upon propagating  on a curved background, waves of positive and negative norm mix to generate outgoing waves.    As a result of this scattering process, field quanta are spontaneously emitted from the vacuum --- the most famous instance of this effect undoubtedly is the mixing of positive and negative norm waves at the horizon of black holes, which results in a steady thermal flux to be emitted from the hole, Hawking radiation [1].    The event horizon of the black hole is the point at which the curvature of spacetime is such that the escape velocity out to infinity becomes superluminal, thus restricting wave propagation to one direction only: toward the central singularity.    Wave propagation on a curved background geometry is not restricted to astrophysics: it is possible to realise an effectively curved geometry with moving wave media in the laboratory, and, in particular, the kinematics of waves at the horizon [2].    An artificial event horizon can be created when a refractive index front (RIF) is moving at the speed of light in a dispersive optical medium [3].    The RIF could be created by a pulse of light that modifies the refractive index by the optical Kerr effect --- a nonlinear effect by which the refractive index depends upon the square of the electric field in the medium.    Light under the pulse will be slowed and thus the front of the pulse exhibits --- for some frequencies --- a black-hole type horizon capturing light. The back of the pulse acts as an impenetrable barrier, a white-hole horizon.    Both event horizons separate two discrete regions: under the pulse, where light is slow and the pulse moves superluminally and outside the pulse, where the pulse speed is subluminal.    We reveal the properties of spontaneous emission from the vacuum at a moving refractive index step in a dispersive dielectric by expanding on an analytical model for light-matter interaction [4]. We establish the conditions for event horizons as a function of the speed and height of the step in the medium, and study the various configurations of modes of the field in the vicinity of the step with and without analogue horizons. We then analytically calculate the emission spectra from all modes of positive and negative norm in the laboratory frame [5]. We find that, as a result of the various mode configurations, the spectrum is highly structured into intervals with black hole-, white hole-, and no horizon.    The emission spectrum in the laboratory frame is found to be a combination of emissions corresponding to different frequencies in the frame moving with the pulse, leading to a characteristic shape. In particular, the existence of a peak in the ultraviolet, associated with emission into a mode with negative norm, is an interesting feature of our spectrum.    We show how emission in this peak may be stimulated by scattering a coherent wave at the horizon.    We also report on an experiment to study the dynamics of waves at the optical horizon.    A weak CW-probe is made to scatter on a RIF created by an intense, ultrashort pulse in a photonic crystal fibre under fine-tuned horizon-like conditions.    As a result of mode conversion at the horizon, light at different wavelengths is generated: the probe is partially shifted in frequency --- positive-to-positive norm conversion occurs as predicted by our theory.    Furthermore, we investigate the companion effect of stimulated emission in a negative norm wave.    The effect of mode conversion is clearly shown to be a feature of horizon physics.    This experiment is a stimulated version of the spontaneous quantum effect at the heart of Hawking radiation.    [1] S. Hawking, Nature 248, 30 (1974).    [2] W.G. Unruh, Phys. Rev. Let. 46 (1981).    [3] T.G. Philbin et al Science 319, 1367 (2008).    [4] S. Finazzi and I. Carusotto, Phys. Rev. A 87, 023803 (2013).    [5] M. Jacquet and F. Koenig, Phys. Rev. A 92, 023851 (2015).",2017-08-22 14:00:00+00:00,20 minutes,Talk,Workshop on continuous variables and quantum information,Workshop on Cont. Variables and Rel. Quantum Information,Maxime Jacquet,
1162,Single Higgs production at LHC as a probe for anomalous Higgs self coupling,"The Higgs trilinear coupling is still a missing piece in the Standard Model puzzle. Although its theoretical value can be extracted from its relation to the mass of the Higgs and the Fermi constant, its measurement through the double Higgs production is particularly challenging. We explore the possibility of probing an anomalous trilinear coupling indirectly, through the production and decay of a single Higgs. Indeed, although these processes do not depend on this coupling at tree level, they are sensitive to the Higgs self-coupling at NLO. This gives us the opportunity to derive the constraints on the trilinear coupling from various observables, like the signal strength of the different channels or the cross-section of the associate Higgs production with top quarks.",2017-08-19 12:00:00+00:00,30 minutes,Talk,Mini-Workshop on Latest Results and New Physics in the Higgs Sector,Mini-Workshop on Latest Results and New Physics in the Higgs Sector,Pier Paolo Giardino,
1163,"Gluons, Heavy and Light Quarks in the QCD Vacuum","Outline of the talk is:    • QCD vacuum, QCD instanton vacuum [1].    • Instanton Liquid Model (ILM) vs Dyons Liquid Model (DLM) [2].    • Gluons in the ILM. Pobylitsa Eq. [3] for the gluon propagator in the ILM.    Dynamical gluon mass.    • Heavy quarks $Q$ in the ILM [4]. $Q\bar Q$-potential within the ILM.      • Heavy and light quarks in the ILM [5].     • Heavy quark light mesons interactions [6].    • Conclusion.    References    [1] D. Diakonov, Prog. Part. Nucl. Phys. 51(2003)173, arXiv:hep-ph/0212026;    T. Schäfer, E. Shuryak, Instantons in QCD, Rev.Mod.Phys. 70(1998)323, hep-ph/9610451;     [2] T.C. Kraan and P. van Baal, Phys. Lett. B428(1998)268, arXiv:hep-th/9802049; Nucl. Phys.    B533(1998)627, arXiv:hep-th/9805168; K. Lee and C. Lu, Phys. Rev. D58(1998)025011, arXiv:hep-th/9802108;    D. Diakonov, Nucl. Phys. Proc. Suppl. 195(2009)5, arXiv:0906.2456 [hep-ph];	    Yizhuang Liu, E. Shuryak, I. Zahed, Phys.Rev. D92(2015)085006, arXiv:1503.03058 [hep-ph];    [3] P. V. Pobylitsa, Phys. Lett. B226(1989)387;    [4] U. Yakhshiev, Hyun-Chul Kim, B. Turimov, M.M. Musakhanov, Emiko Hiyama, Instanton effects on the heavy-quark static potential,  Chinese Physics C (accepted for the publication), arXiv:1602.06074 [hep-ph];    [5] M. Musakhanov, Eur. Phys. J. C 9 (1999) 235; M. Musakhanov, Heavy-light quarks interactions in QCD vacuum, PoS BaldinISHEPPXXII (2015) 012, arXiv:1412.4472 [hep-ph];    [6] M. Musakhanov, Heavy-heavy and heavy-light quarks interactions generated by QCD vacuum,    EPJ Web Conf. 137 (2017) 03013, arXiv:1703.07825 [hep-ph].",2017-08-22 14:00:00+00:00,30 minutes,Talk,Parallel session,Mini-Workshop on Latest Results and New Physics in the Higgs Sector,Mirzayusuf Musakhanov,https://indico.cern.ch/event/559774/contributions/2647682/attachments/1508567/2351604/Musakhanov-ICNFP17-day2208-time17-room5.pdf
1164,Chaotic Quantum Many-Body Systems and Philosophy of Thermalization,"Quantum many-body chaos is described as a practical (theoretical. experimental, and computational) instrument in physics of mesoscopic systems of interacting particles.    Using nuclear, atomic and spin physics applications, it is shown that interactions of constituents    create stationary states of high complexity with respect to the mean-field basis with observable properties smoothly changing along the spectrum. Both local chaotic features and the global evolution along the spectrum are used to understand many-body physics and define    thermodynamic properties of isolated mesoscopic objects (no heat bath). Physical applications,    experimental, theoretical and computational, are discussed. Artificially introduced chaotic elements can be used to explore the landscape of possible states of the system and predict phase transformations.",2017-08-17 11:30:00+00:00,40 minutes,Lecture,Lectures,Lectures,Vladimir Zelevinsky,
1165,Covariant density functionals in nuclear physics and their microscopic origin.,"The description of the structure of nuclei in the framework of effective mean-field models are remarkably successful over almost the entire periodic table. Relativistic and non-relativistic versions of this approach enable an effective description of the nuclear many-body problem as an energy density functional. Such theories are used with great success in all quantum mechanical many-body systems. In Coulombic systems, density functional theory is exact and can be derived from the bare Coulomb force without additional phenomenological parameters.  In nuclear physics with spin and isospin degrees of freedom, the situation is much more complicated due to the strong nucleon-nucleon and three-body forces. At present, all attempts to derive these functionals directly from the bare forces do not reach the required accuracy. In recent years, however, there have been several attempts to derive semi-microscopic functionals. They start with microscopic Brueckner-Hartree-Fock calculations in nuclear matter.  These results are then mapped on a Walecka model to adjust in this way basic properties of the covariant density functionals. Only very few additional, phenomenological parameters are necessary to for a fine-tuning and in this way universal covariant density functionals have been derived  which provide an excellent description of ground states and excited states all over the periodic table with a high predictive power.    These semi-microscopic functionals suffer from the fact, that there form is not directly derived from ab initio calculations, only there parameters are adjusted. Therefore, recently, Relativistic Brueckner-Hartree-Fock    theory in finite nuclei has been used to derive the self-consistent mean field and the ground state properties of spherical doubly closed shell nuclei. Starting from a realistic bare nucleon-nucleon (NN) force adjusted to nuclear scattering data, the relativistic G-matrix is obtained as an effective interaction by  solving the Bethe-Goldstone equation in a self-consistent basis. This G-matrix is inserted in a relativistic Hartree-Fock code for finite nuclei and in each step of the iteration a new G-matrix is calculated by solving the Bethe-Goldstone equation for the Pauli-operator derived from the corresponding Fermi surface in the finite system. The self-consistent solution of this iteration process allows to calculate ground state properties of finite nuclei without any adjustable parameters. No three-body forces are used. First results are shown for the doubly magic nuclei $^{4}$He, $^{16}$O, and $^{48}$Ca. Their ground state properties, such as binding energies, charge radii, or spin-orbit splittings are largely improved as compared with the results obtained from non-relativistic Brueckner-Hartree-Fock theory. It is discussed that this theory provides a method to study  also the ground state properties of heavy nuclei in \textit{ab initio} calculations.    $^{*}$ Work supported by the DFG (Germany) cluster of excellence ""Origin and    Structure of the Universe"" (www.universe-cluster.de)",2017-08-21 12:30:00+00:00,30 minutes,Talk,S. Belyaev Memorial Session,Spartak Belyaev Memorial Session,Peter Ring,
1166,Self-consistent description of particle-phonon coupling effects. Pole and tadpole diagrams.,"Since the famous article of 1959 by S.T. Belyaev [1], a crucial role of the first 2+ excitations in even-even nuclei, the quadrupole “phonons”, is one of conventional cornerstones of nuclear theory. The quadrupole phonons are the surface vibrations, belonging to the Goldstone branch  related to the spontaneous breaking of the translation symmetry in nuclei. In the modern self-consistent nuclear theories based on the use of the effective energy density functionals (EDFs), a problem of accounting for effects of particle-phonon coupling (PC) effects looks rather delicate as they are included to the EDF phenomenological parameters on average. Hence, there is a problem of ”double counting”.    Within the self-consistent Theory of Finite Fermi Systems (TFFS), we developed a model for    consideration of the PC corrections to electromagnetic moments of odd spherical nuclei in which the fluctuating part of such corrections is taken into account only. The main idea of this model is to separate and explicitly consider such PC diagrams that behave in a non-regular way, depending significantly on the nucleus under consideration and the single-particle state of the odd nucleon. The rest (and the major part) of the PC corrections is supposed to be regular and included in the initial values of the TFFS parameters. In addition to the usual pole diagrams, so-called tadpole ones are included to the calculation scheme. The self-consistent scheme we use is based on the Fayans EDF [2].    In such approach, the quadruple phonos are most important, as their collectivity behaves in a    non-regular way, changing dramatically from double magic nuclei to non-magic neighbors. The model is developed for semi-magic nuclei, which contain a superfluid subsystem and a normal one, and besides the odd nucleon belongs to the normal subsystem. It simplifies the problem drastically. In addition, a non-regular behavior of the PC corrections is typical namely for the normal subsystem  of a semi-magic nucleus. The model was used for finding PC corrections to the magnetic [3] and quadrupole [4] moments of the proton-odd neighbors of the even Pb and Sn isotopes.   Among the PC terms, the ”end correction” and the induced interaction one are sufficiently bigger than all other. However, they have opposite signs and cancel each other significantly. Therefore, the self-consistency of the calculations is of primary importance. In the result, ”small corrections”, in particular the one due to the magnetic moment or quadrupole moment of the phonon, play also a role. In the last case, the tadpole diagram is of principal importance. In our calculations, rather good description of the data was obtained without any adjusted parameters.    1. S.T. Belyaev, Mat.-Fys. Medd. Kgl. Dan. Wid. Selsk.,   31, 31 (1959).    2.  S.A. Fayans, S.V. Tolokonnikov, E.L. Trykov, and D. Zawischa, Nucl. Phys. A 676, 49 (2000).    3. E.E. Saperstein, S. Kamerdzhiev, S. Krewald, J. Speth, and S.V. Tolokonnikov, EPL 103, 42001 (2013).    4. E.E. Saperstein, S. Kamerdzhiev, S.V. Tolokonnikov, and D. Voitenkov, J. Phys. G: Nucl. Part. Phys.  44, 065104 (2016).",2017-08-22 09:30:00+00:00,30 minutes,Talk,S. Belyaev Memorial Session,Spartak Belyaev Memorial Session,Eduard Saperstein,
1167,Electron Ion Collider: 3D-Imaging the Nucleon,"The Electron Ion Collider (EIC) is the project for a new US-based, high-energy, high-luminosity facility, capable of a versatile range of beam energies, polarizations, and ion species. Its primary goal is to precisely image quarks and gluons and their interactions inside hadrons, in order to investigate their confined dynamics and elucidate how visible matter is made at its most fundamental level. I will describe the current status of the project and briefly touch upon the main physics questions addressed by such a facility. If time allows, I will give few more details on the topic of Transverse Momentum Dependent parton distributions (TMDs).",2017-08-22 14:00:00+00:00,30 minutes,Talk,Special Session on Instruments and Methods in HEP,A High Energy Particle Physics:,Marco Radici,
1169,The Gamow Shell Model - Towards the unified theory of nuclear structure and reactions,"Gamow shell model (GSM), the complex-energy continuum shell model in Berggren basis, can be equivalently formulated either in the basis of Slater determinants, or in the basis of reaction channels, providing the unified approach to nuclear structure and reactions. In the Sater determinant representation, GSM is a tool par excellence for nuclear structure studies of bound and unbound many-body states. In the second representation, GSM provides the microscopic theory of low energy reactions and many-body resonances. In the talk, I will present this unified theory of structure and reactions and give examples of recent applications.",2017-08-22 10:00:00+00:00,30 minutes,Lecture,S. Belyaev Memorial Session,Spartak Belyaev Memorial Session,Marek Ploszajczak,
1170,Multi Purpose Detector at NICA: Status and Prospects,"The Multi Purpose Detector (MPD) at the NICA Collider is under construction to study hot and baryon rich QCD matter in heavy ion collisions, up to gold, in the energy range √SNN = 4 -11 GeV. The program includes the study of collective phenomena, dilepton, hyperon and hypernuclei production under extreme conditions of highest net baryonic density.",2017-08-25 07:00:00+00:00,30 minutes,Talk,Workshop on Physics at FAIR-NICA-SPS-BES/RHIC,Workshop on Physics at FAIR-NICA-SPS-BES/RHIC,Vladimir Kekelidze,
1171,Varying constants quantum cosmologies,Varying speed of light (VSL) theories can be considered as another type of modified gravity theories. In such models the value of speed of light is usually represented by some additional dynamical scalar degree of freedom. In this talk I will consider some basic foundational concepts of VSL theories an argue that some of them can lead to interesting alternative scenarios of quantum cosmogenesis.,2017-08-21 16:30:00+00:00,1 hour,Poster,Poster session,Special session on Astro-Cosmo-Gravity,Adam Balcerzak,
1172,Locality and nonlocality in the interaction-free measurement,"We present a paradox involving a particle and a mirror. They exchange a nonlocal quantity - weak modular angular momentum, $\langle L_z ~\rm{mod}~2\hbar\rangle_w$ - but no local interaction between them seems to allow such an exchange. We demonstrate that the particle and mirror $do$ interact locally via a $local$ $current$ of $\langle L_z ~\rm{mod}~2\hbar\rangle_w$. In this sense, we transform the ""interaction-free measurement"" of Elitzur and Vaidman, in which two local quantities (the positions of a photon and a bomb in the two arms of a Mach-Zehnder interferometer) interact nonlocally, into a thought experiment in which two nonlocal quantities (the modular angular momentum of the particle and of the mirror) interact locally.",2017-08-24 07:00:00+00:00,30 minutes,Talk,Workshop on Quantum Foundations and Quantum Information,Workshop on Quantum Foundations and Quantum Information,Daniel ROHRLICH,
1173,Possible Approach to Dynamical Supersymmetry Breaking via Nambu--Jona-Lasinio Model,"Supersymmetry is undoubtedly a popular candidate for physics beyond the Standard Model. However, the origin of soft supersymmetry breaking masses has been usually depicted intricately in the literature via extra hidden/mediating sectors. Thus, a simple theory for the generation of the soft masses would be more compelling. Recently, our group discussed in two sequential papers a new approach to dynamical supersymmetry breaking via Nambu--Jona-Lasinio Model, which has been missed since the first investigation of supersymmetric NJL model. We introduce a four-superfield interaction term that induces a real two-superfield composite with vacuum condensate. The latter has supersymmetry breaking parts, which we show to bear nontrivial solutions following a standard nonperturbative analysis for a NJL type model. In the talk, I will discuss this possibility of dynamical supersymmetry breaking, and present the prototype model, with the analysis of effective theory picture. The presence of the expected Goldstino along with the supersymmetry breaking will be also demonstrated.",2017-08-21 16:30:00+00:00,1 hour,Poster,Poster session,A High Energy Particle Physics:,Yifan Cheng,
1175,Core-collapse supernovae explored by neutrino transfer and nuclear data,"Core-collapse supernovae are vital for the evolution of elements, stars and galaxies.  I would like to overview the current status of supernova studies with neutrino and nuclear physics.  I focus on recent progress of the neutrino-radiation hydrodynamics in 2D/3D and remaining mysteries.  Recently we can solve directly the Boltzmann equation in 6D (3D space + 3D momentum of neutrino) coupled with 2D/3D hydrodynamics under recent supercomputing technologies.  I report the latest results of the core-collapse simulations of massive stars, which lead to successful/non-successful explosions.  We are now at a new stage to examine the neutrino and nuclear physics for supernova explosions by solving the neutrino transfer without the approximations used so far.  I would like to discuss influence of nuclear physics (dense matter and neutrino reactions) on explosions and observational signals such as supernova neutrinos.",2017-08-25 06:00:00+00:00,30 minutes,Talk,"D Astroparticle, Cosmology,d Gravity, Math Phys",Special session on Astro-Cosmo-Gravity,Kosuke Sumiyoshi,
1176,"Understanding X(3862), X(3872), and X(3930) in a Friedrichs-model-like scheme","We developed a Friedrichs-model-like scheme in studying the hadron    resonance phenomenology and present that the hadron resonances might    be regarded as the Gamow states produced by a Hamiltonian  in which    the bare discrete state is described by the result of usual quark    potential model and the interaction part is described    by the quark pair creation model. In an almost parameter-free    calculation, the $X(3862)$,  $X(3872)$, and $X(3930)$ state could be    simultaneously produced with a quite good accuracy by coupling the    three P-wave states, $\chi_{c2}(2P)$, $\chi_{c1}(2P)$, $\chi_{c0}(2P)$    predicted in the Godfrey-Isgur model to  the $D\bar D$, $D\bar D^{*}$, $D^*\bar D^*$    continuum states. At the same time, we predict that the $h_c(2P)$    state is at about 3890 MeV with a width of about 44 MeV. In this    calculation, the $X(3872)$ state has a large compositeness.  This scheme    may shed more light on the long-standing problem about the general    discrepancy between the prediction of the quark model and the observed    values, and it may also provide reference for future search for the    hadron resonance state.",2017-08-23 09:00:00+00:00,30 minutes,Talk,Workshop on Exotic Hadrons,Workshop on Exotic Hadrons,Zhiguang Xiao,
1177,"Matter waves exposed to the external world: Decoherence, gravity, complementarity and time irreversibility","Matter-wave interferometry provides an excellent tool for probing the environment and studying its coupling to isolated atoms. We will present several interferometry experiments done with a BEC on an atom chip [1] and in which different effects of the environment have been investigated. First, we will discuss fluctuations in the nearby environment probed by an interference of atoms trapped in a magnetic lattice very close (5μm) to a room temperature surface [2,3]. Here an order-of-magnitude improvement has been obtained over previous atom-surface distances for which spatial interference has been observed. Next, we will present a new interferometry of self-interfering clocks and show, in a proof-of-principle experiment, how it could probe the interplay of QM and GR [4]. We will also describe a rule for “clock complementarity”, which we deduce theoretically and verify experimentally [5]. Finally, we will discuss Stern-Gerlach interferometry [6] and describe it in the context of time irreversibility [7]. To the best of our knowledge, this is the first time spatial Stern-Gerlach interferometry has been realized, and we analyze our data in the context of previous theoretical work relating the difficulties in realizing Stern-Gerlach interferometry to time irreversibility.     [1] Mark Keil, Omer Amit, Shuyu Zhou, David Groswasser, Yonathan Japha, Ron Folman, “Fifteen years of cold matter on the atom chip: Promise, realizations and prospects”, Journal of Modern Optics 63, 1840 (2016).    [2] Shuyu Zhou, David Groswasser, Mark Keil, Yonathan Japha, Ron Folman, “Robust spatial coherence 5m from a room temperature atom-chip”, Phys. Rev. A 93, 063615 (2016).     [3] Yonathan Japha, Shuyu Zhou, Mark Keil and Ron Folman, Carsten Henkel, Amichay Vardi, “Suppression and enhancement of decoherence in an atomic Josephson junction”, New J. Phys. 18, 055008 (2016).    [4] Yair Margalit, Zhifan Zhou, Shimon Machluf, Daniel Rohrlich, Yonathan Japha, Ron Folman, “A self-interfering clock as a ‘which path’ witness”, Science 349, 1205 (2015).    [5] Atom Chip group, “Clock complementarity in the context of general relativity”, in preparation.    [6] Shimon Machluf, Yonathan Japha and Ron Folman, “Coherent Stern-Gerlach momentum splitting on an atom chip”, Nature Communications 4, 2424 (2013).    [7] Atom Chip group, “Probing the emergence of the arrow of time with a high visibility Stern-Gerlach interferometer”, in preparation.",2017-08-23 14:30:00+00:00,30 minutes,Talk,Workshop on Quantum Foundations and Quantum Information,Workshop on Quantum Foundations and Quantum Information,Ron Folman,
